{
  "coverage": {
    "filesScanned": 3,
    "unsupported": [
      "declared closure, not installed tree: node_modules is never read",
      "no Dockerfile or compose file found: images[] is empty by absence, not by proof",
      "npm: alias packages/app:sw-cjs -> string-width@4.2.3: the real package is a node; the alias name is hashed as an opaque entry",
      "pnpm catalog reference packages/app:is-number (catalog:): catalog range not dereferenced; edge spec kept verbatim",
      "pnpm package 'is-positive@https://codeload.github.com/kevva/is-positive/tar.gz/97edff6f525f192a3f83cea1944765f769ae2678': non-registry resolution (tarball URL / git / file: / directory) — no locked registry identity in this slice; hashed as an opaque entry, no node",
      "pnpm patchedDependencies 'is-odd@3.0.1': a local patch alters the installed package; the node integrity is the UNPATCHED registry tarball — the patch hash is hashed as an opaque entry",
      "pnpm workspace importers other than '.' have no locked identity: they are not nodes and their direct-dependency edges are attributed to the root node",
      "pnpm-lock v9 carries no dev/peer flags: dev = not reachable through any importer dependencies/optionalDependencies, peer = reachable only through peerDependencies edges (derived, not read)",
      "pnpm-lock v9 does not record install scripts: installScript is false for every pnpm node (unknown, not proven absent)",
      "pnpm-lock v9 records resolved versions, not ranges, for transitive dependencies: edge spec is '' except importer (specifier) and peer (peerDependencies) edges",
      "workspace/link entry packages/app:synth-lib -> link:../lib: local package not part of the declared closure in slice 1; hashed as an opaque entry, no node"
    ]
  },
  "ctRepoRevision": "synthetic-pnpm-v9-fixture",
  "edges": [
    {
      "dev": false,
      "from": "npm:ajv-keywords@5.1.0",
      "optional": false,
      "peer": true,
      "spec": "^8.8.2",
      "to": "npm:ajv@8.20.0"
    },
    {
      "dev": false,
      "from": "npm:ajv-keywords@5.1.0",
      "optional": false,
      "peer": false,
      "spec": "",
      "to": "npm:fast-deep-equal@3.1.3"
    },
    {
      "dev": false,
      "from": "npm:ajv@8.20.0",
      "optional": false,
      "peer": false,
      "spec": "",
      "to": "npm:fast-deep-equal@3.1.3"
    },
    {
      "dev": false,
      "from": "npm:ajv@8.20.0",
      "optional": false,
      "peer": false,
      "spec": "",
      "to": "npm:fast-uri@3.1.8"
    },
    {
      "dev": false,
      "from": "npm:ajv@8.20.0",
      "optional": false,
      "peer": false,
      "spec": "",
      "to": "npm:json-schema-traverse@1.0.0"
    },
    {
      "dev": false,
      "from": "npm:ajv@8.20.0",
      "optional": false,
      "peer": false,
      "spec": "",
      "to": "npm:require-from-string@2.0.2"
    },
    {
      "dev": false,
      "from": "npm:is-odd@3.0.1",
      "optional": false,
      "peer": false,
      "spec": "",
      "to": "npm:is-number@6.0.0"
    },
    {
      "dev": false,
      "from": "npm:loose-envify@1.4.0",
      "optional": false,
      "peer": false,
      "spec": "",
      "to": "npm:js-tokens@4.0.0"
    },
    {
      "dev": false,
      "from": "npm:react@17.0.2",
      "optional": false,
      "peer": false,
      "spec": "",
      "to": "npm:loose-envify@1.4.0"
    },
    {
      "dev": false,
      "from": "npm:react@17.0.2",
      "optional": false,
      "peer": false,
      "spec": "",
      "to": "npm:object-assign@4.1.1"
    },
    {
      "dev": false,
      "from": "npm:react@18.2.0",
      "optional": false,
      "peer": false,
      "spec": "",
      "to": "npm:loose-envify@1.4.0"
    },
    {
      "dev": false,
      "from": "npm:rollup@4.18.0",
      "optional": true,
      "peer": false,
      "spec": "",
      "to": "npm:@rollup/rollup-android-arm-eabi@4.18.0"
    },
    {
      "dev": false,
      "from": "npm:rollup@4.18.0",
      "optional": true,
      "peer": false,
      "spec": "",
      "to": "npm:@rollup/rollup-android-arm64@4.18.0"
    },
    {
      "dev": false,
      "from": "npm:rollup@4.18.0",
      "optional": true,
      "peer": false,
      "spec": "",
      "to": "npm:@rollup/rollup-darwin-arm64@4.18.0"
    },
    {
      "dev": false,
      "from": "npm:rollup@4.18.0",
      "optional": true,
      "peer": false,
      "spec": "",
      "to": "npm:@rollup/rollup-darwin-x64@4.18.0"
    },
    {
      "dev": false,
      "from": "npm:rollup@4.18.0",
      "optional": true,
      "peer": false,
      "spec": "",
      "to": "npm:@rollup/rollup-linux-arm-gnueabihf@4.18.0"
    },
    {
      "dev": false,
      "from": "npm:rollup@4.18.0",
      "optional": true,
      "peer": false,
      "spec": "",
      "to": "npm:@rollup/rollup-linux-arm-musleabihf@4.18.0"
    },
    {
      "dev": false,
      "from": "npm:rollup@4.18.0",
      "optional": true,
      "peer": false,
      "spec": "",
      "to": "npm:@rollup/rollup-linux-arm64-gnu@4.18.0"
    },
    {
      "dev": false,
      "from": "npm:rollup@4.18.0",
      "optional": true,
      "peer": false,
      "spec": "",
      "to": "npm:@rollup/rollup-linux-arm64-musl@4.18.0"
    },
    {
      "dev": false,
      "from": "npm:rollup@4.18.0",
      "optional": true,
      "peer": false,
      "spec": "",
      "to": "npm:@rollup/rollup-linux-powerpc64le-gnu@4.18.0"
    },
    {
      "dev": false,
      "from": "npm:rollup@4.18.0",
      "optional": true,
      "peer": false,
      "spec": "",
      "to": "npm:@rollup/rollup-linux-riscv64-gnu@4.18.0"
    },
    {
      "dev": false,
      "from": "npm:rollup@4.18.0",
      "optional": true,
      "peer": false,
      "spec": "",
      "to": "npm:@rollup/rollup-linux-s390x-gnu@4.18.0"
    },
    {
      "dev": false,
      "from": "npm:rollup@4.18.0",
      "optional": true,
      "peer": false,
      "spec": "",
      "to": "npm:@rollup/rollup-linux-x64-gnu@4.18.0"
    },
    {
      "dev": false,
      "from": "npm:rollup@4.18.0",
      "optional": true,
      "peer": false,
      "spec": "",
      "to": "npm:@rollup/rollup-linux-x64-musl@4.18.0"
    },
    {
      "dev": false,
      "from": "npm:rollup@4.18.0",
      "optional": true,
      "peer": false,
      "spec": "",
      "to": "npm:@rollup/rollup-win32-arm64-msvc@4.18.0"
    },
    {
      "dev": false,
      "from": "npm:rollup@4.18.0",
      "optional": true,
      "peer": false,
      "spec": "",
      "to": "npm:@rollup/rollup-win32-ia32-msvc@4.18.0"
    },
    {
      "dev": false,
      "from": "npm:rollup@4.18.0",
      "optional": true,
      "peer": false,
      "spec": "",
      "to": "npm:@rollup/rollup-win32-x64-msvc@4.18.0"
    },
    {
      "dev": false,
      "from": "npm:rollup@4.18.0",
      "optional": false,
      "peer": false,
      "spec": "",
      "to": "npm:@types/estree@1.0.5"
    },
    {
      "dev": false,
      "from": "npm:rollup@4.18.0",
      "optional": true,
      "peer": false,
      "spec": "",
      "to": "npm:fsevents@2.3.3"
    },
    {
      "dev": false,
      "from": "npm:string-width@4.2.3",
      "optional": false,
      "peer": false,
      "spec": "",
      "to": "npm:emoji-regex@8.0.0"
    },
    {
      "dev": false,
      "from": "npm:string-width@4.2.3",
      "optional": false,
      "peer": false,
      "spec": "",
      "to": "npm:is-fullwidth-code-point@3.0.0"
    },
    {
      "dev": false,
      "from": "npm:string-width@4.2.3",
      "optional": false,
      "peer": false,
      "spec": "",
      "to": "npm:strip-ansi@6.0.1"
    },
    {
      "dev": false,
      "from": "npm:strip-ansi@6.0.1",
      "optional": false,
      "peer": false,
      "spec": "",
      "to": "npm:ansi-regex@5.0.1"
    },
    {
      "dev": false,
      "from": "npm:synth-workspace-root@1.2.3",
      "optional": false,
      "peer": false,
      "spec": "5.1.0",
      "to": "npm:ajv-keywords@5.1.0"
    },
    {
      "dev": false,
      "from": "npm:synth-workspace-root@1.2.3",
      "optional": true,
      "peer": false,
      "spec": "2.3.3",
      "to": "npm:fsevents@2.3.3"
    },
    {
      "dev": false,
      "from": "npm:synth-workspace-root@1.2.3",
      "optional": false,
      "peer": false,
      "spec": "catalog:",
      "to": "npm:is-number@7.0.0"
    },
    {
      "dev": false,
      "from": "npm:synth-workspace-root@1.2.3",
      "optional": false,
      "peer": false,
      "spec": "3.0.1",
      "to": "npm:is-odd@3.0.1"
    },
    {
      "dev": false,
      "from": "npm:synth-workspace-root@1.2.3",
      "optional": false,
      "peer": false,
      "spec": "17.0.2",
      "to": "npm:react@17.0.2"
    },
    {
      "dev": false,
      "from": "npm:synth-workspace-root@1.2.3",
      "optional": false,
      "peer": false,
      "spec": "18.2.0",
      "to": "npm:react@18.2.0"
    },
    {
      "dev": true,
      "from": "npm:synth-workspace-root@1.2.3",
      "optional": false,
      "peer": false,
      "spec": "4.18.0",
      "to": "npm:rollup@4.18.0"
    },
    {
      "dev": false,
      "from": "npm:synth-workspace-root@1.2.3",
      "optional": false,
      "peer": false,
      "spec": "npm:string-width@^4.2.0",
      "to": "npm:string-width@4.2.3"
    },
    {
      "dev": false,
      "from": "npm:synth-workspace-root@1.2.3",
      "optional": true,
      "peer": false,
      "spec": "1.2.0",
      "to": "npm:use-sync-external-store@1.2.0"
    },
    {
      "dev": false,
      "from": "npm:synth-workspace-root@1.2.3",
      "optional": false,
      "peer": false,
      "spec": "1.2.0",
      "to": "npm:use-sync-external-store@1.2.0"
    },
    {
      "dev": false,
      "from": "npm:synth-workspace-root@1.2.3",
      "optional": false,
      "peer": false,
      "spec": "8.17.0",
      "to": "npm:ws@8.17.0"
    },
    {
      "dev": false,
      "from": "npm:use-sync-external-store@1.2.0",
      "optional": false,
      "peer": true,
      "spec": "^16.8.0 || ^17.0.0 || ^18.0.0",
      "to": "npm:react@17.0.2"